{"$schema":"https://json-schema.org/draft/2020-12/schema","title":"Appointment Event","type":"object","additionalProperties":false,"required":["schemaVersion","sourceEventId","channel","customerId","resourceId","serviceType","startsAt","durationMinutes"],"properties":{"schemaVersion":{"const":"1.0"},"sourceEventId":{"type":"string","minLength":1,"maxLength":128},"channel":{"enum":["web","phone","email","whatsapp"]},"customerId":{"type":"string","minLength":1},"resourceId":{"type":"string","minLength":1},"serviceType":{"type":"string","minLength":1},"startsAt":{"type":"string","format":"date-time"},"durationMinutes":{"type":"integer","minimum":15,"maximum":480},"timezone":{"type":"string"},"estimatedValue":{"type":"number","minimum":0},"consentToReminders":{"type":"boolean"},"receivedAt":{"type":"string","format":"date-time"},"metadata":{"type":"object","additionalProperties":{"type":["string","number","boolean"]}}}}
